{
  "selection_date": "2026-10-21",
  "contract": "corpus-candidates-v1",
  "scanning_authorization": "not-granted",
  "scope": "purposive-descriptive-not-confirmatory",
  "candidates": [
    {
      "candidate_id": "R01",
      "repository": "langchain-samples/cicd-pipeline-example",
      "revision": "5ab0d0a0f3c90999f786f834d9c05484dfe5f2bf",
      "kind": "application",
      "role": "existing-formative-pilot",
      "prescreen_files": 47,
      "prescreen_python_files": 26,
      "reported_license": "MIT",
      "selection_rationale": "Application; existing LangGraph CI/CD pilot",
      "lineage_note": "Shared LangChain ecosystem; independent project status not established."
    },
    {
      "candidate_id": "R02",
      "repository": "qdrant/mcp-server-qdrant",
      "revision": "c56ae5adf62bb78d852bf7bbcbc5d7b75e2bbe41",
      "kind": "mcp",
      "role": "existing-formative-pilot",
      "prescreen_files": 34,
      "prescreen_python_files": 19,
      "reported_license": "Apache-2.0",
      "selection_rationale": "MCP; existing vector-store pilot",
      "lineage_note": "Non-fork flag in metadata prescreen; source lineage requires review."
    },
    {
      "candidate_id": "R03",
      "repository": "chroma-core/chroma-mcp",
      "revision": "98ff67589bdcc31b730a5415ff9529433f949077",
      "kind": "mcp",
      "role": "prospective-descriptive-candidate",
      "prescreen_files": 16,
      "prescreen_python_files": 3,
      "reported_license": "Apache-2.0",
      "selection_rationale": "MCP; compact database integration",
      "lineage_note": "Non-fork flag in metadata prescreen; source lineage requires review."
    },
    {
      "candidate_id": "R04",
      "repository": "redis/mcp-redis",
      "revision": "b814c36c6309d5e2e5ea238b86ff25f60edc0ce8",
      "kind": "mcp",
      "role": "prospective-descriptive-candidate",
      "prescreen_files": 60,
      "prescreen_python_files": 44,
      "reported_license": "MIT",
      "selection_rationale": "MCP; data/search/server operations",
      "lineage_note": "Non-fork flag in metadata prescreen; source lineage requires review."
    },
    {
      "candidate_id": "R05",
      "repository": "motherduckdb/mcp-server-motherduck",
      "revision": "41acb581d9bc04e427655ba5178b2c5c01f68cd2",
      "kind": "mcp",
      "role": "prospective-descriptive-candidate",
      "prescreen_files": 47,
      "prescreen_python_files": 31,
      "reported_license": "MIT",
      "selection_rationale": "MCP; SQL and local/remote database interfaces",
      "lineage_note": "Non-fork flag in metadata prescreen; source lineage requires review."
    },
    {
      "candidate_id": "R06",
      "repository": "neo4j-contrib/mcp-neo4j",
      "revision": "1c7ad0793b5f06b42b9c44f855c23eb2064c3bb7",
      "kind": "mcp",
      "role": "prospective-descriptive-candidate",
      "prescreen_files": 131,
      "prescreen_python_files": 50,
      "reported_license": "MIT",
      "selection_rationale": "MCP; graph/memory/cloud modules",
      "lineage_note": "Non-fork flag in metadata prescreen; source lineage requires review."
    },
    {
      "candidate_id": "R07",
      "repository": "dbt-labs/dbt-mcp",
      "revision": "3365e6dd75d1bb4ff92cceb25da6d1a59454b002",
      "kind": "mcp",
      "role": "prospective-descriptive-candidate",
      "prescreen_files": 580,
      "prescreen_python_files": 273,
      "reported_license": "Apache-2.0",
      "selection_rationale": "MCP; data tooling and larger Python selection",
      "lineage_note": "Non-fork flag in metadata prescreen; source lineage requires review."
    },
    {
      "candidate_id": "R08",
      "repository": "MarkusPfundstein/mcp-obsidian",
      "revision": "5ee0b84fa8319fd2fdf0db0ee1febb065e712a15",
      "kind": "mcp",
      "role": "prospective-descriptive-candidate",
      "prescreen_files": 26,
      "prescreen_python_files": 15,
      "reported_license": "MIT",
      "selection_rationale": "MCP; note/document API integration",
      "lineage_note": "Non-fork flag in metadata prescreen; source lineage requires review."
    },
    {
      "candidate_id": "R09",
      "repository": "ckreiling/mcp-server-docker",
      "revision": "57a7df208fdc2362505835f670e53c66f3717c48",
      "kind": "mcp",
      "role": "prospective-descriptive-candidate",
      "prescreen_files": 16,
      "prescreen_python_files": 5,
      "reported_license": "GPL-3.0",
      "selection_rationale": "MCP; container-management source",
      "lineage_note": "Non-fork flag in metadata prescreen; source lineage requires review."
    },
    {
      "candidate_id": "R10",
      "repository": "langchain-ai/local-deep-researcher",
      "revision": "96555649619b9c482442f2cba043312bd7692507",
      "kind": "application",
      "role": "prospective-descriptive-candidate",
      "prescreen_files": 16,
      "prescreen_python_files": 7,
      "reported_license": "MIT",
      "selection_rationale": "Application; web-research workflow",
      "lineage_note": "Shared LangChain ecosystem; independent project status not established."
    },
    {
      "candidate_id": "R11",
      "repository": "langchain-ai/open_deep_research",
      "revision": "1b7d2e80db9faa586165c60e09096dbbfd483a64",
      "kind": "application",
      "role": "prospective-descriptive-candidate",
      "prescreen_files": 45,
      "prescreen_python_files": 22,
      "reported_license": "MIT",
      "selection_rationale": "Application; larger research workflow",
      "lineage_note": "Shared LangChain ecosystem; independent project status not established."
    },
    {
      "candidate_id": "R12",
      "repository": "virattt/ai-hedge-fund",
      "revision": "4e1657ddc689e3939c481a8f0955444b10f02dc9",
      "kind": "application",
      "role": "prospective-descriptive-candidate",
      "prescreen_files": 139,
      "prescreen_python_files": 118,
      "reported_license": "MIT",
      "selection_rationale": "Application; multi-agent domain workflow",
      "lineage_note": "Non-fork flag in metadata prescreen; source lineage requires review."
    },
    {
      "candidate_id": "R13",
      "repository": "FoundationAgents/OpenManus",
      "revision": "3309bf4e416fb1c74b008f3e86494439a31bad53",
      "kind": "application",
      "role": "prospective-descriptive-candidate",
      "prescreen_files": 145,
      "prescreen_python_files": 90,
      "reported_license": "MIT",
      "selection_rationale": "Application; general task/tool automation",
      "lineage_note": "Non-fork flag in metadata prescreen; source lineage requires review."
    },
    {
      "candidate_id": "R14",
      "repository": "langchain-ai/react-agent",
      "revision": "087d90d0c876668956b733a104f1708cef0128e2",
      "kind": "template",
      "role": "prospective-descriptive-candidate",
      "prescreen_files": 26,
      "prescreen_python_files": 12,
      "reported_license": "MIT",
      "selection_rationale": "Template; compact tool-use loop",
      "lineage_note": "Shared LangChain ecosystem; independent project status not established."
    },
    {
      "candidate_id": "R15",
      "repository": "langchain-ai/retrieval-agent-template",
      "revision": "6a441ef6018b5465c5e97f4b3ca88b807b4b6fb2",
      "kind": "template",
      "role": "prospective-descriptive-candidate",
      "prescreen_files": 26,
      "prescreen_python_files": 13,
      "reported_license": "MIT",
      "selection_rationale": "Template; retrieval/context workflow",
      "lineage_note": "Shared LangChain ecosystem; independent project status not established."
    },
    {
      "candidate_id": "R16",
      "repository": "huggingface/smolagents",
      "revision": "96f33faaf028479119ec8d34507b47694cf14e34",
      "kind": "framework",
      "role": "prospective-descriptive-candidate",
      "prescreen_files": 185,
      "prescreen_python_files": 75,
      "reported_license": "Apache-2.0",
      "selection_rationale": "Framework; code/tool-execution abstractions",
      "lineage_note": "Non-fork flag in metadata prescreen; source lineage requires review."
    },
    {
      "candidate_id": "R17",
      "repository": "andrewyng/aisuite",
      "revision": "66c7890c2d68c2d67f41723bc848bb6713d82a9c",
      "kind": "library",
      "role": "prospective-descriptive-candidate",
      "prescreen_files": 747,
      "prescreen_python_files": 355,
      "reported_license": "MIT",
      "selection_rationale": "Library; model/provider/tool-call interfaces",
      "lineage_note": "Non-fork flag in metadata prescreen; source lineage requires review."
    },
    {
      "candidate_id": "R18",
      "repository": "openai/swarm",
      "revision": "6af0b4caf37dca4526dfd98e9fbd8ce36e7eeb22",
      "kind": "framework",
      "role": "prospective-descriptive-candidate",
      "prescreen_files": 288,
      "prescreen_python_files": 62,
      "reported_license": "MIT",
      "selection_rationale": "Educational framework; handoff/orchestration",
      "lineage_note": "Non-fork flag in metadata prescreen; source lineage requires review."
    },
    {
      "candidate_id": "R19",
      "repository": "run-llama/llama-agents",
      "revision": "656b3fc5a37debfb44ddcf90b51488e59e3564d4",
      "kind": "framework",
      "role": "prospective-descriptive-candidate",
      "prescreen_files": 852,
      "prescreen_python_files": 516,
      "reported_license": "MIT",
      "selection_rationale": "Framework; event/workflow orchestration",
      "lineage_note": "Non-fork flag in metadata prescreen; source lineage requires review."
    },
    {
      "candidate_id": "R20",
      "repository": "microsoft/TaskWeaver",
      "revision": "d44ddef23f90059fb17999d3095db4240e98f955",
      "kind": "framework",
      "role": "prospective-descriptive-candidate",
      "prescreen_files": 421,
      "prescreen_python_files": 167,
      "reported_license": "MIT",
      "selection_rationale": "Framework; planning/code/plugin interfaces",